{
  "schema_version": 1,
  "task_id": "replace-me",
  "attempt": 1,
  "role": "tester",
  "actor_id": "replace-with-fresh-test-run-id",
  "started_at": "2026-01-01T00:04:00Z",
  "finished_at": "2026-01-01T00:05:00Z",
  "owned_paths": ["tests/test_replace_me.py"],
  "summary": "Focused regression validation.",
  "evidence": ["test output or report path"],
  "commands": [{"command": "python -m pytest tests/test_replace_me.py", "exit_code": 0, "notes": ""}],
  "gaps": [],
  "status": "passed"
}

